[
  {
    "id": "gq-resumer",
    "categorie": "question",
    "question": "Si vous deviez répondre à votre question en une seule phrase ?",
    "pistes": [
      "Aie ta phrase de conclusion prête : c'est elle.",
      "Commence par « oui », « non » ou « en partie », puis donne la raison principale."
    ],
    "order": 0
  },
  {
    "id": "gq-exemple",
    "categorie": "question",
    "question": "Pouvez-vous donner un exemple concret de ce que vous venez d'expliquer ?",
    "pistes": [
      "Prévois pour chaque partie un exemple chiffré simple, faisable de tête.",
      "Un exemple de la vie courante rend l'idée accessible au membre du jury non spécialiste."
    ],
    "order": 1
  },
  {
    "id": "gq-limites",
    "categorie": "question",
    "question": "Votre réponse est-elle toujours vraie ? Quelles en sont les limites ?",
    "pistes": [
      "Nomme les hypothèses de ton modèle et ce qui se passe quand elles tombent.",
      "Une limite bien identifiée montre de l'esprit critique : ce n'est pas un aveu de faiblesse."
    ],
    "order": 2
  },
  {
    "id": "gq-objection",
    "categorie": "question",
    "question": "Quel argument pourrait-on vous opposer ?",
    "pistes": [
      "Prépare l'objection la plus sérieuse à ta réponse, et ce que tu y réponds.",
      "Reconnais ce qu'elle a de juste avant de dire pourquoi ta réponse tient quand même."
    ],
    "order": 3
  },
  {
    "id": "gq-definition",
    "categorie": "cours",
    "question": "Pouvez-vous redonner la définition précise de la notion centrale de votre exposé ?",
    "pistes": [
      "Les mots exacts du cours, puis une reformulation simple.",
      "Si la notion a des conditions (continuité, système isolé…), cite-les d'emblée."
    ],
    "order": 4
  },
  {
    "id": "gq-formule",
    "categorie": "cours",
    "question": "D'où vient la formule que vous avez utilisée ? Que représente chaque lettre ?",
    "pistes": [
      "Donne l'origine : une loi, une définition, une démonstration du cours.",
      "Chaque grandeur avec son unité, et le domaine où la formule s'applique."
    ],
    "order": 5
  },
  {
    "id": "gq-demonstration",
    "categorie": "cours",
    "question": "Pourriez-vous démontrer ce résultat que vous avez admis ?",
    "pistes": [
      "Annonce l'idée de la preuve avant de te lancer dans les calculs.",
      "Si tu ne te souviens pas de tout, dis quelle étape te manque et comment tu la chercherais."
    ],
    "order": 6
  },
  {
    "id": "gq-ordre-grandeur",
    "categorie": "cours",
    "question": "Quel est l'ordre de grandeur de ce résultat ? Est-ce cohérent ?",
    "pistes": [
      "Un calcul approché de tête, avec l'unité.",
      "Compare à une valeur connue de la vie courante pour juger de la cohérence."
    ],
    "order": 7
  },
  {
    "id": "gq-courbe",
    "categorie": "cours",
    "question": "Pouvez-vous tracer l'allure de la courbe dont vous parlez ?",
    "pistes": [
      "Les axes et leurs grandeurs d'abord, puis les points remarquables.",
      "Commente en traçant : croissance, limite, asymptote, valeur particulière."
    ],
    "order": 8
  },
  {
    "id": "gq-sources",
    "categorie": "demarche",
    "question": "Où avez-vous trouvé cette information ? Comment savez-vous qu'elle est fiable ?",
    "pistes": [
      "Cite une source précise : manuel, article, site d'un organisme scientifique.",
      "Explique comment tu l'as recoupée avec une autre source ou avec ton cours."
    ],
    "order": 9
  },
  {
    "id": "gq-travail",
    "categorie": "demarche",
    "question": "Comment avez-vous travaillé cette question pendant l'année ?",
    "pistes": [
      "Les étapes réelles : l'idée de départ, ce qui a changé en cours de route, ce qui a été difficile.",
      "Un moment où tu t'es trompé et ce que tu en as tiré est un bon exemple."
    ],
    "order": 10
  },
  {
    "id": "gq-autre-discipline",
    "categorie": "demarche",
    "question": "Une autre discipline pourrait-elle éclairer votre question ?",
    "pistes": [
      "Relier les savoirs fait partie de ce que valorise le jury : prépare un lien avec ton autre spécialité.",
      "Un lien avec l'histoire des sciences, la philosophie ou l'actualité peut aussi ouvrir la réponse."
    ],
    "order": 11
  },
  {
    "id": "gq-projet",
    "categorie": "demarche",
    "question": "Pourquoi avez-vous choisi de travailler cette question ?",
    "pistes": [
      "D'où vient ta question, ce qu'elle t'a appris, ce qu'elle ouvre pour la suite.",
      "Une raison vraie, même modeste, vaut mieux qu'une motivation arrangée."
    ],
    "order": 12
  },
  {
    "id": "gq-approfondir",
    "categorie": "demarche",
    "question": "Qu'aimeriez-vous approfondir sur ce sujet si vous en aviez le temps ?",
    "pistes": [
      "Une piste précise, pas « tout » : un modèle plus fin, une expérience, un prolongement mathématique.",
      "Dis ce qu'il faudrait pour y aller : une notion de plus, une mesure, un calcul."
    ],
    "order": 13
  },
  {
    "id": "gq-sur",
    "categorie": "piege",
    "question": "Vous êtes sûr de ce que vous avancez ?",
    "pistes": [
      "Ne change pas d'avis par réflexe : revérifie à voix haute.",
      "Maintiens en expliquant pourquoi si tu as raison ; corrige-toi franchement sinon."
    ],
    "order": 14
  },
  {
    "id": "gq-transposer",
    "categorie": "piege",
    "question": "Pourriez-vous appliquer ce raisonnement à une situation que vous n'avez pas préparée ?",
    "pistes": [
      "Pars de ce que tu sais et raisonne à voix haute : le jury regarde ta démarche.",
      "Un « je ne sais pas, mais voici comment je chercherais » vaut mieux qu'une réponse inventée."
    ],
    "order": 15
  }
]
